{"artifact":{"promotable_checkpoint":"ema-final.pt","root":"artifacts/diffusion-prior-v2/{contract_sha256}","save_intermediate":false},"dataset":{"device":"cpu","dtype":"float32","num_videos":5000,"shape":[5000,20,64,64],"source_counts":{"procedural:7":1250,"procedural:L":1250,"procedural:T":1250,"procedural:circle":1250},"sources":["procedural:7","procedural:L","procedural:T","procedural:circle"]},"logical_id":"gsdiff-diffusion-prior-v2","model":{"base_channels":32,"channel_mults":[1,2,4],"emb_dim":128,"in_channels":1},"motion":{"fill_mode":"constant-zero","interpolation_order":1,"normalized_time":[0.0,1.0],"omega_range":[-0.5,0.5],"operation_order":["rotation","shift"],"output_clip":[0.0,1.0],"vx_range":[-12.0,12.0],"vy_range":[-12.0,12.0]},"noise":{"objective":"epsilon-prediction-mse","sigma_max":0.5,"sigma_min":0.002},"resources":{"minimum_cuda_memory_bytes":12000000000,"minimum_free_disk_bytes":6442450944},"rng":{"bit_generator":"MT19937","dataset_seed":0,"draw_order":["vy","vx","omega","child_seed"],"training_seed":42},"schema":"diffusion-prior-contract-v2","training":{"amp":false,"batch_size":8,"batches_per_epoch":625,"checkpoint_selection":false,"dataloader_generator_seed":42,"device":"cuda:0","drop_last":true,"ema_decay":0.999,"ema_update_order":"after-optimizer-step","epochs":200,"gradient_clip_norm":1.0,"optimizer":{"amsgrad":false,"betas":[0.9,0.999],"capturable":false,"differentiable":false,"eps":1e-08,"foreach":false,"fused":false,"lr":0.0001,"maximize":false,"name":"AdamW","weight_decay":1e-05},"optimizer_steps":125000,"resume":false,"shuffle":true,"workers":0}}
